{
  "blueprint": {
    "graphs": [
      {
        "class": "/Script/Engine.EdGraph",
        "edges": [
          {
            "direction_is_valid": true,
            "id": "/Game/LensCorpus/BP_LC3_ValueProvenance.BP_LC3_ValueProvenance:EventGraph::edge::/Game/LensCorpus/BP_LC3_ValueProvenance.BP_LC3_ValueProvenance:EventGraph::node::0ed63f6c-478a-8511-f83b-faa83f12245a::pin::locator-output-BaseScore-0->/Game/LensCorpus/BP_LC3_ValueProvenance.BP_LC3_ValueProvenance:EventGraph::node::4d2e8f23-41cf-19cf-1196-399c762340b2::pin::locator-input-A-0",
            "kind": "data",
            "source_node_id": "/Game/LensCorpus/BP_LC3_ValueProvenance.BP_LC3_ValueProvenance:EventGraph::node::0ed63f6c-478a-8511-f83b-faa83f12245a",
            "source_pin_id": "/Game/LensCorpus/BP_LC3_ValueProvenance.BP_LC3_ValueProvenance:EventGraph::node::0ed63f6c-478a-8511-f83b-faa83f12245a::pin::locator-output-BaseScore-0",
            "target_node_id": "/Game/LensCorpus/BP_LC3_ValueProvenance.BP_LC3_ValueProvenance:EventGraph::node::4d2e8f23-41cf-19cf-1196-399c762340b2",
            "target_pin_id": "/Game/LensCorpus/BP_LC3_ValueProvenance.BP_LC3_ValueProvenance:EventGraph::node::4d2e8f23-41cf-19cf-1196-399c762340b2::pin::locator-input-A-0"
          },
          {
            "direction_is_valid": true,
            "id": "/Game/LensCorpus/BP_LC3_ValueProvenance.BP_LC3_ValueProvenance:EventGraph::edge::/Game/LensCorpus/BP_LC3_ValueProvenance.BP_LC3_ValueProvenance:EventGraph::node::1c0c5ab4-430b-c560-c3b3-8f8e0cf18c53::pin::locator-output-then-0->/Game/LensCorpus/BP_LC3_ValueProvenance.BP_LC3_ValueProvenance:EventGraph::node::893fe8b6-4000-8e4f-8772-f8ae66264c08::pin::locator-input-execute-0",
            "kind": "execution",
            "source_node_id": "/Game/LensCorpus/BP_LC3_ValueProvenance.BP_LC3_ValueProvenance:EventGraph::node::1c0c5ab4-430b-c560-c3b3-8f8e0cf18c53",
            "source_pin_id": "/Game/LensCorpus/BP_LC3_ValueProvenance.BP_LC3_ValueProvenance:EventGraph::node::1c0c5ab4-430b-c560-c3b3-8f8e0cf18c53::pin::locator-output-then-0",
            "target_node_id": "/Game/LensCorpus/BP_LC3_ValueProvenance.BP_LC3_ValueProvenance:EventGraph::node::893fe8b6-4000-8e4f-8772-f8ae66264c08",
            "target_pin_id": "/Game/LensCorpus/BP_LC3_ValueProvenance.BP_LC3_ValueProvenance:EventGraph::node::893fe8b6-4000-8e4f-8772-f8ae66264c08::pin::locator-input-execute-0"
          },
          {
            "direction_is_valid": true,
            "id": "/Game/LensCorpus/BP_LC3_ValueProvenance.BP_LC3_ValueProvenance:EventGraph::edge::/Game/LensCorpus/BP_LC3_ValueProvenance.BP_LC3_ValueProvenance:EventGraph::node::47c141e6-4997-d0f0-e561-a0826aba9bf2::pin::locator-output-Penalty-0->/Game/LensCorpus/BP_LC3_ValueProvenance.BP_LC3_ValueProvenance:EventGraph::node::d2f0f839-4b2e-4f8a-f883-149baa7a24b6::pin::locator-input-B-0",
            "kind": "data",
            "source_node_id": "/Game/LensCorpus/BP_LC3_ValueProvenance.BP_LC3_ValueProvenance:EventGraph::node::47c141e6-4997-d0f0-e561-a0826aba9bf2",
            "source_pin_id": "/Game/LensCorpus/BP_LC3_ValueProvenance.BP_LC3_ValueProvenance:EventGraph::node::47c141e6-4997-d0f0-e561-a0826aba9bf2::pin::locator-output-Penalty-0",
            "target_node_id": "/Game/LensCorpus/BP_LC3_ValueProvenance.BP_LC3_ValueProvenance:EventGraph::node::d2f0f839-4b2e-4f8a-f883-149baa7a24b6",
            "target_pin_id": "/Game/LensCorpus/BP_LC3_ValueProvenance.BP_LC3_ValueProvenance:EventGraph::node::d2f0f839-4b2e-4f8a-f883-149baa7a24b6::pin::locator-input-B-0"
          },
          {
            "direction_is_valid": true,
            "id": "/Game/LensCorpus/BP_LC3_ValueProvenance.BP_LC3_ValueProvenance:EventGraph::edge::/Game/LensCorpus/BP_LC3_ValueProvenance.BP_LC3_ValueProvenance:EventGraph::node::4d2e8f23-41cf-19cf-1196-399c762340b2::pin::locator-output-ReturnValue-0->/Game/LensCorpus/BP_LC3_ValueProvenance.BP_LC3_ValueProvenance:EventGraph::node::d2f0f839-4b2e-4f8a-f883-149baa7a24b6::pin::locator-input-A-0",
            "kind": "data",
            "source_node_id": "/Game/LensCorpus/BP_LC3_ValueProvenance.BP_LC3_ValueProvenance:EventGraph::node::4d2e8f23-41cf-19cf-1196-399c762340b2",
            "source_pin_id": "/Game/LensCorpus/BP_LC3_ValueProvenance.BP_LC3_ValueProvenance:EventGraph::node::4d2e8f23-41cf-19cf-1196-399c762340b2::pin::locator-output-ReturnValue-0",
            "target_node_id": "/Game/LensCorpus/BP_LC3_ValueProvenance.BP_LC3_ValueProvenance:EventGraph::node::d2f0f839-4b2e-4f8a-f883-149baa7a24b6",
            "target_pin_id": "/Game/LensCorpus/BP_LC3_ValueProvenance.BP_LC3_ValueProvenance:EventGraph::node::d2f0f839-4b2e-4f8a-f883-149baa7a24b6::pin::locator-input-A-0"
          },
          {
            "direction_is_valid": true,
            "id": "/Game/LensCorpus/BP_LC3_ValueProvenance.BP_LC3_ValueProvenance:EventGraph::edge::/Game/LensCorpus/BP_LC3_ValueProvenance.BP_LC3_ValueProvenance:EventGraph::node::d2f0f839-4b2e-4f8a-f883-149baa7a24b6::pin::locator-output-ReturnValue-0->/Game/LensCorpus/BP_LC3_ValueProvenance.BP_LC3_ValueProvenance:EventGraph::node::893fe8b6-4000-8e4f-8772-f8ae66264c08::pin::locator-input-LC3Score-0",
            "kind": "data",
            "source_node_id": "/Game/LensCorpus/BP_LC3_ValueProvenance.BP_LC3_ValueProvenance:EventGraph::node::d2f0f839-4b2e-4f8a-f883-149baa7a24b6",
            "source_pin_id": "/Game/LensCorpus/BP_LC3_ValueProvenance.BP_LC3_ValueProvenance:EventGraph::node::d2f0f839-4b2e-4f8a-f883-149baa7a24b6::pin::locator-output-ReturnValue-0",
            "target_node_id": "/Game/LensCorpus/BP_LC3_ValueProvenance.BP_LC3_ValueProvenance:EventGraph::node::893fe8b6-4000-8e4f-8772-f8ae66264c08",
            "target_pin_id": "/Game/LensCorpus/BP_LC3_ValueProvenance.BP_LC3_ValueProvenance:EventGraph::node::893fe8b6-4000-8e4f-8772-f8ae66264c08::pin::locator-input-LC3Score-0"
          },
          {
            "direction_is_valid": true,
            "id": "/Game/LensCorpus/BP_LC3_ValueProvenance.BP_LC3_ValueProvenance:EventGraph::edge::/Game/LensCorpus/BP_LC3_ValueProvenance.BP_LC3_ValueProvenance:EventGraph::node::d579ea07-4b75-80a4-baf1-4682a24c8237::pin::locator-output-BonusScore-0->/Game/LensCorpus/BP_LC3_ValueProvenance.BP_LC3_ValueProvenance:EventGraph::node::4d2e8f23-41cf-19cf-1196-399c762340b2::pin::locator-input-B-0",
            "kind": "data",
            "source_node_id": "/Game/LensCorpus/BP_LC3_ValueProvenance.BP_LC3_ValueProvenance:EventGraph::node::d579ea07-4b75-80a4-baf1-4682a24c8237",
            "source_pin_id": "/Game/LensCorpus/BP_LC3_ValueProvenance.BP_LC3_ValueProvenance:EventGraph::node::d579ea07-4b75-80a4-baf1-4682a24c8237::pin::locator-output-BonusScore-0",
            "target_node_id": "/Game/LensCorpus/BP_LC3_ValueProvenance.BP_LC3_ValueProvenance:EventGraph::node::4d2e8f23-41cf-19cf-1196-399c762340b2",
            "target_pin_id": "/Game/LensCorpus/BP_LC3_ValueProvenance.BP_LC3_ValueProvenance:EventGraph::node::4d2e8f23-41cf-19cf-1196-399c762340b2::pin::locator-input-B-0"
          }
        ],
        "id": "/Game/LensCorpus/BP_LC3_ValueProvenance.BP_LC3_ValueProvenance:EventGraph",
        "kind": "event",
        "name": "EventGraph",
        "nodes": [
          {
            "class": "/Script/BlueprintGraph.K2Node_VariableGet",
            "id": "/Game/LensCorpus/BP_LC3_ValueProvenance.BP_LC3_ValueProvenance:EventGraph::node::0ed63f6c-478a-8511-f83b-faa83f12245a",
            "identity_source": "node_guid",
            "native_guid": "0ed63f6c-478a-8511-f83b-faa83f12245a",
            "pins": [
              {
                "default": {
                  "object_path": "",
                  "text": "",
                  "value": ""
                },
                "direction": "input",
                "hidden": true,
                "id": "/Game/LensCorpus/BP_LC3_ValueProvenance.BP_LC3_ValueProvenance:EventGraph::node::0ed63f6c-478a-8511-f83b-faa83f12245a::pin::locator-input-self-0",
                "identity_source": "pin_locator",
                "kind": "data",
                "name": "self",
                "node_id": "/Game/LensCorpus/BP_LC3_ValueProvenance.BP_LC3_ValueProvenance:EventGraph::node::0ed63f6c-478a-8511-f83b-faa83f12245a",
                "not_connectable": false,
                "orphaned": false,
                "persistent_guid": "",
                "pin_role": "none",
                "type": {
                  "category": "object",
                  "container": "none",
                  "is_const": false,
                  "is_reference": false,
                  "is_uobject_wrapper": false,
                  "is_weak_pointer": false,
                  "object_path": "/Game/LensCorpus/BP_LC3_ValueProvenance.BP_LC3_ValueProvenance_C",
                  "serialize_as_single_precision_float": false,
                  "subcategory": "None"
                }
              },
              {
                "default": {
                  "object_path": "",
                  "text": "",
                  "value": "0"
                },
                "direction": "output",
                "hidden": false,
                "id": "/Game/LensCorpus/BP_LC3_ValueProvenance.BP_LC3_ValueProvenance:EventGraph::node::0ed63f6c-478a-8511-f83b-faa83f12245a::pin::locator-output-BaseScore-0",
                "identity_source": "pin_locator",
                "kind": "data",
                "name": "BaseScore",
                "node_id": "/Game/LensCorpus/BP_LC3_ValueProvenance.BP_LC3_ValueProvenance:EventGraph::node::0ed63f6c-478a-8511-f83b-faa83f12245a",
                "not_connectable": false,
                "orphaned": false,
                "persistent_guid": "",
                "pin_role": "none",
                "type": {
                  "category": "int",
                  "container": "none",
                  "is_const": false,
                  "is_reference": false,
                  "is_uobject_wrapper": false,
                  "is_weak_pointer": false,